{
  "protocol_version": "timed_expert_baseline_v2",
  "plan_version": "human_baseline_plan_v1",
  "release_id": null,
  "generated_at": "2026-07-09T00:45:07.255Z",
  "minimum_humans": 3,
  "summary": {
    "target_worlds": 20,
    "required_sessions": 60,
    "completed_sessions": 0,
    "assigned_sessions": 0,
    "unassigned_sessions": 60,
    "worlds_complete": 0,
    "worlds_fully_assigned_or_complete": 0,
    "invalid_baseline_records": 0
  },
  "worlds": [
    {
      "world_id": "holdout-2026q3-01-revenue_leakage",
      "domain": "revenue_reconciliation",
      "minimum_humans": 3,
      "sessions": [
        {
          "slot": 1,
          "status": "unassigned",
          "world_id": "holdout-2026q3-01-revenue_leakage",
          "domain": "revenue_reconciliation",
          "required_expertise": "revenue reconciliation domain expert"
        },
        {
          "slot": 2,
          "status": "unassigned",
          "world_id": "holdout-2026q3-01-revenue_leakage",
          "domain": "revenue_reconciliation",
          "required_expertise": "revenue reconciliation domain expert"
        },
        {
          "slot": 3,
          "status": "unassigned",
          "world_id": "holdout-2026q3-01-revenue_leakage",
          "domain": "revenue_reconciliation",
          "required_expertise": "revenue reconciliation domain expert"
        }
      ],
      "completed_sessions": 0,
      "assigned_sessions": 0,
      "unassigned_sessions": 3
    },
    {
      "world_id": "holdout-2026q3-02-incident_trust_recovery",
      "domain": "incident_response",
      "minimum_humans": 3,
      "sessions": [
        {
          "slot": 1,
          "status": "unassigned",
          "world_id": "holdout-2026q3-02-incident_trust_recovery",
          "domain": "incident_response",
          "required_expertise": "incident response domain expert"
        },
        {
          "slot": 2,
          "status": "unassigned",
          "world_id": "holdout-2026q3-02-incident_trust_recovery",
          "domain": "incident_response",
          "required_expertise": "incident response domain expert"
        },
        {
          "slot": 3,
          "status": "unassigned",
          "world_id": "holdout-2026q3-02-incident_trust_recovery",
          "domain": "incident_response",
          "required_expertise": "incident response domain expert"
        }
      ],
      "completed_sessions": 0,
      "assigned_sessions": 0,
      "unassigned_sessions": 3
    },
    {
      "world_id": "holdout-2026q3-03-design_accessibility_gate",
      "domain": "design_accessibility",
      "minimum_humans": 3,
      "sessions": [
        {
          "slot": 1,
          "status": "unassigned",
          "world_id": "holdout-2026q3-03-design_accessibility_gate",
          "domain": "design_accessibility",
          "required_expertise": "design accessibility domain expert"
        },
        {
          "slot": 2,
          "status": "unassigned",
          "world_id": "holdout-2026q3-03-design_accessibility_gate",
          "domain": "design_accessibility",
          "required_expertise": "design accessibility domain expert"
        },
        {
          "slot": 3,
          "status": "unassigned",
          "world_id": "holdout-2026q3-03-design_accessibility_gate",
          "domain": "design_accessibility",
          "required_expertise": "design accessibility domain expert"
        }
      ],
      "completed_sessions": 0,
      "assigned_sessions": 0,
      "unassigned_sessions": 3
    },
    {
      "world_id": "holdout-2026q3-04-sales_discount_approval",
      "domain": "sales_policy",
      "minimum_humans": 3,
      "sessions": [
        {
          "slot": 1,
          "status": "unassigned",
          "world_id": "holdout-2026q3-04-sales_discount_approval",
          "domain": "sales_policy",
          "required_expertise": "sales policy domain expert"
        },
        {
          "slot": 2,
          "status": "unassigned",
          "world_id": "holdout-2026q3-04-sales_discount_approval",
          "domain": "sales_policy",
          "required_expertise": "sales policy domain expert"
        },
        {
          "slot": 3,
          "status": "unassigned",
          "world_id": "holdout-2026q3-04-sales_discount_approval",
          "domain": "sales_policy",
          "required_expertise": "sales policy domain expert"
        }
      ],
      "completed_sessions": 0,
      "assigned_sessions": 0,
      "unassigned_sessions": 3
    },
    {
      "world_id": "holdout-2026q3-05-support_escalation_sla",
      "domain": "support_sla",
      "minimum_humans": 3,
      "sessions": [
        {
          "slot": 1,
          "status": "unassigned",
          "world_id": "holdout-2026q3-05-support_escalation_sla",
          "domain": "support_sla",
          "required_expertise": "support sla domain expert"
        },
        {
          "slot": 2,
          "status": "unassigned",
          "world_id": "holdout-2026q3-05-support_escalation_sla",
          "domain": "support_sla",
          "required_expertise": "support sla domain expert"
        },
        {
          "slot": 3,
          "status": "unassigned",
          "world_id": "holdout-2026q3-05-support_escalation_sla",
          "domain": "support_sla",
          "required_expertise": "support sla domain expert"
        }
      ],
      "completed_sessions": 0,
      "assigned_sessions": 0,
      "unassigned_sessions": 3
    },
    {
      "world_id": "holdout-2026q3-06-vendor_renewal_risk",
      "domain": "vendor_renewal",
      "minimum_humans": 3,
      "sessions": [
        {
          "slot": 1,
          "status": "unassigned",
          "world_id": "holdout-2026q3-06-vendor_renewal_risk",
          "domain": "vendor_renewal",
          "required_expertise": "vendor renewal domain expert"
        },
        {
          "slot": 2,
          "status": "unassigned",
          "world_id": "holdout-2026q3-06-vendor_renewal_risk",
          "domain": "vendor_renewal",
          "required_expertise": "vendor renewal domain expert"
        },
        {
          "slot": 3,
          "status": "unassigned",
          "world_id": "holdout-2026q3-06-vendor_renewal_risk",
          "domain": "vendor_renewal",
          "required_expertise": "vendor renewal domain expert"
        }
      ],
      "completed_sessions": 0,
      "assigned_sessions": 0,
      "unassigned_sessions": 3
    },
    {
      "world_id": "holdout-2026q3-07-data_retention_policy",
      "domain": "privacy_retention",
      "minimum_humans": 3,
      "sessions": [
        {
          "slot": 1,
          "status": "unassigned",
          "world_id": "holdout-2026q3-07-data_retention_policy",
          "domain": "privacy_retention",
          "required_expertise": "privacy retention domain expert"
        },
        {
          "slot": 2,
          "status": "unassigned",
          "world_id": "holdout-2026q3-07-data_retention_policy",
          "domain": "privacy_retention",
          "required_expertise": "privacy retention domain expert"
        },
        {
          "slot": 3,
          "status": "unassigned",
          "world_id": "holdout-2026q3-07-data_retention_policy",
          "domain": "privacy_retention",
          "required_expertise": "privacy retention domain expert"
        }
      ],
      "completed_sessions": 0,
      "assigned_sessions": 0,
      "unassigned_sessions": 3
    },
    {
      "world_id": "holdout-2026q3-08-partner_launch_handoff",
      "domain": "partner_launch",
      "minimum_humans": 3,
      "sessions": [
        {
          "slot": 1,
          "status": "unassigned",
          "world_id": "holdout-2026q3-08-partner_launch_handoff",
          "domain": "partner_launch",
          "required_expertise": "partner launch domain expert"
        },
        {
          "slot": 2,
          "status": "unassigned",
          "world_id": "holdout-2026q3-08-partner_launch_handoff",
          "domain": "partner_launch",
          "required_expertise": "partner launch domain expert"
        },
        {
          "slot": 3,
          "status": "unassigned",
          "world_id": "holdout-2026q3-08-partner_launch_handoff",
          "domain": "partner_launch",
          "required_expertise": "partner launch domain expert"
        }
      ],
      "completed_sessions": 0,
      "assigned_sessions": 0,
      "unassigned_sessions": 3
    },
    {
      "world_id": "holdout-2026q3-09-analytics_metric_drift",
      "domain": "analytics_drift",
      "minimum_humans": 3,
      "sessions": [
        {
          "slot": 1,
          "status": "unassigned",
          "world_id": "holdout-2026q3-09-analytics_metric_drift",
          "domain": "analytics_drift",
          "required_expertise": "analytics drift domain expert"
        },
        {
          "slot": 2,
          "status": "unassigned",
          "world_id": "holdout-2026q3-09-analytics_metric_drift",
          "domain": "analytics_drift",
          "required_expertise": "analytics drift domain expert"
        },
        {
          "slot": 3,
          "status": "unassigned",
          "world_id": "holdout-2026q3-09-analytics_metric_drift",
          "domain": "analytics_drift",
          "required_expertise": "analytics drift domain expert"
        }
      ],
      "completed_sessions": 0,
      "assigned_sessions": 0,
      "unassigned_sessions": 3
    },
    {
      "world_id": "holdout-2026q3-10-security_scope_change",
      "domain": "security_scope",
      "minimum_humans": 3,
      "sessions": [
        {
          "slot": 1,
          "status": "unassigned",
          "world_id": "holdout-2026q3-10-security_scope_change",
          "domain": "security_scope",
          "required_expertise": "security scope domain expert"
        },
        {
          "slot": 2,
          "status": "unassigned",
          "world_id": "holdout-2026q3-10-security_scope_change",
          "domain": "security_scope",